{
  "code": "lower-secondary-term",
  "name": "Lower secondary term report",
  "levels": ["S1", "S2", "S3", "S4"],
  "page": {
    "size": "A4",
    "orientation": "portrait"
  },
  "blocks": [
    { "type": "header", "label_key": "block.header" },
    { "type": "learner", "label_key": "block.learner" },
    { "type": "attendance", "label_key": "block.attendance" },
    {
      "type": "results_table",
      "label_key": "block.results",
      "columns": ["slots", "total", "grade", "points", "teacher_initials", "remark"]
    },
    { "type": "summary", "label_key": "block.summary" },
    { "type": "comments", "label_key": "block.comments" },
    { "type": "signatures", "label_key": "block.signatures" },
    { "type": "verification", "label_key": "block.verification" }
  ],
  "comment_max_length": 500
}
