{
  "code": "pearson-ial-candidate",
  "name": "International A Level candidate report",
  "levels": [
    "Y12",
    "Y13"
  ],
  "page": {
    "size": "A4",
    "orientation": "portrait"
  },
  "blocks": [
    {
      "type": "header",
      "label_key": "block.header"
    },
    {
      "type": "learner",
      "label_key": "block.learner"
    },
    {
      "type": "attendance",
      "label_key": "block.attendance"
    },
    {
      "type": "results_table",
      "label_key": "block.results",
      "columns": [
        "slots",
        "total",
        "grade",
        "points",
        "teacher_initials",
        "remark"
      ]
    },
    {
      "type": "summary",
      "label_key": "block.summary"
    },
    {
      "type": "progression",
      "label_key": "block.progression"
    },
    {
      "type": "comments",
      "label_key": "block.comments"
    },
    {
      "type": "signatures",
      "label_key": "block.signatures"
    },
    {
      "type": "verification",
      "label_key": "block.verification"
    }
  ],
  "comment_max_length": 500
}
