{
  "code": "gb-secondary-term",
  "name": "Key stage 3 and 4 term report",
  "levels": [
    "Y7",
    "Y8",
    "Y9",
    "Y10",
    "Y11"
  ],
  "page": {
    "size": "A4",
    "orientation": "portrait"
  },
  "blocks": [
    {
      "type": "header",
      "label_key": "block.header"
    },
    {
      "type": "learner",
      "label_key": "block.learner"
    },
    {
      "type": "attendance",
      "label_key": "block.attendance"
    },
    {
      "type": "results_table",
      "label_key": "block.results",
      "columns": [
        "slots",
        "total",
        "grade",
        "points",
        "class_mean",
        "teacher_initials",
        "remark"
      ]
    },
    {
      "type": "competencies",
      "label_key": "block.competencies"
    },
    {
      "type": "summary",
      "label_key": "block.summary"
    },
    {
      "type": "comments",
      "label_key": "block.comments"
    },
    {
      "type": "signatures",
      "label_key": "block.signatures"
    },
    {
      "type": "verification",
      "label_key": "block.verification"
    }
  ],
  "comment_max_length": 500
}
