{
  "code": "gb-eyfs-profile",
  "name": "Early Years Foundation Stage profile report",
  "levels": [
    "N1",
    "N2"
  ],
  "page": {
    "size": "A4",
    "orientation": "portrait"
  },
  "blocks": [
    {
      "type": "header",
      "label_key": "block.header"
    },
    {
      "type": "learner",
      "label_key": "block.learner"
    },
    {
      "type": "attendance",
      "label_key": "block.attendance"
    },
    {
      "type": "rubric_table",
      "label_key": "block.rubric"
    },
    {
      "type": "competencies",
      "label_key": "block.competencies"
    },
    {
      "type": "comments",
      "label_key": "block.comments"
    },
    {
      "type": "signatures",
      "label_key": "block.signatures"
    },
    {
      "type": "verification",
      "label_key": "block.verification"
    }
  ],
  "comment_max_length": 400
}
